{
  "id": "cra",
  "nombre": "CRA — Reglamento de Ciberresiliencia para los productos con elementos digitales",
  "referencia_oficial": "Reglamento (UE) 2024/2847 del Parlamento Europeo y del Consejo, de 23 de octubre de 2024, relativo a los requisitos horizontales de ciberseguridad para los productos con elementos digitales (Reglamento de Ciberresiliencia)",
  "descripcion": "Reglamento europeo que establece, por primera vez de forma horizontal, requisitos obligatorios de ciberseguridad para todos los productos con elementos digitales (software, hardware con componentes digitales y dispositivos IoT) comercializados en la Unión Europea. Obliga a los fabricantes a incorporar la seguridad desde el diseño y por defecto, a gestionar las vulnerabilidades durante todo el periodo de soporte del producto, a documentar la conformidad mediante documentación técnica y declaración UE de conformidad, a colocar el marcado CE y a notificar a ENISA y al CSIRT coordinador las vulnerabilidades aprovechadas activamente y los incidentes graves. Las preguntas se centran en las obligaciones de los operadores económicos (especialmente fabricantes) y en los requisitos esenciales de ciberseguridad del Anexo I. El Reglamento es plenamente aplicable desde el 11 de diciembre de 2027, si bien las obligaciones de notificación del Art. 14 aplican desde el 11 de septiembre de 2026.",
  "sectores_aplicables": [
    "fabricante",
    "importador",
    "distribuidor",
    "representante_autorizado"
  ],
  "fecha_aplicabilidad_general": "2027-12-11",
  "bloques": [
    {
      "id": "CRA-AMB",
      "nombre": "Ámbito de aplicación y clasificación del producto",
      "descripcion": "Determinación de la aplicabilidad del Reglamento al producto con elementos digitales, identificación del rol del operador económico y clasificación del producto según su criticidad (producto ordinario, importante de clase I, importante de clase II o producto crítico), de la que depende el procedimiento de evaluación de la conformidad aplicable.",
      "temas": [
        "product_cybersecurity",
        "compliance_assessment"
      ],
      "peso_bloque": 14,
      "fecha_aplicabilidad": "2027-12-11",
      "preguntas": [
        {
          "id": "CRA-AMB-001",
          "texto": "¿Se ha verificado y documentado que el producto entra en el ámbito de aplicación del CRA por ser un producto con elementos digitales cuya finalidad prevista o uso razonablemente previsible incluye una conexión de datos directa o indirecta a un dispositivo o red, y se han comprobado las exclusiones del Art. 2?",
          "ayuda": "El Art. 2 del CRA fija un ámbito de aplicación muy amplio: cualquier producto consistente en software o hardware, y sus soluciones de tratamiento de datos a distancia, cuya finalidad prevista o uso razonablemente previsible incluya una conexión a un dispositivo o red. El Reglamento excluye expresamente determinados productos ya regulados por normativa sectorial: productos sanitarios (Reglamentos UE 2017/745 y 2017/746), vehículos de motor (Reglamento UE 2019/2144), aeronaves (Reglamento UE 2018/1139), equipos marinos, las piezas de recambio idénticas y los productos desarrollados exclusivamente con fines de seguridad nacional, defensa o tratamiento de información clasificada. Si no se delimita correctamente el ámbito, el fabricante puede aplicar un régimen equivocado o quedar fuera de cobertura sin justificación documental.",
          "requisito_original": "El presente Reglamento es aplicable a los productos con elementos digitales comercializados cuya finalidad prevista o uso razonablemente previsible incluya una conexión de datos directa o indirecta, lógica o física, a un dispositivo o red. El presente Reglamento no es aplicable a los productos con elementos digitales a los que sean aplicables los Reglamentos (UE) 2017/745, (UE) 2017/746 y (UE) 2019/2144, ni a los certificados de conformidad con el Reglamento (UE) 2018/1139, ni a los equipos que entran en el ámbito de la Directiva 2014/90/UE, ni a las piezas de recambio idénticas, ni a los productos desarrollados o modificados exclusivamente con fines de seguridad nacional o defensa o diseñados específicamente para el tratamiento de información clasificada.",
          "tipo": "obligatorio",
          "aplicabilidad": [
            "fabricante",
            "importador",
            "distribuidor"
          ],
          "peso": 9,
          "nivel": "critico",
          "fase_pds": 1,
          "remediacion": "Elaborar y documentar un análisis de aplicabilidad que identifique el carácter del producto como producto con elementos digitales, su finalidad prevista, el uso razonablemente previsible, las soluciones de tratamiento de datos a distancia asociadas y la capacidad de conexión a dispositivos o redes. Verificar de forma expresa la concurrencia o no de las exclusiones del Art. 2. Conservar el análisis como parte de la documentación técnica y revisarlo ante cambios en el producto o en la normativa sectorial.",
          "referencia_articulo": "Arts. 1 y 2 Reglamento (UE) 2024/2847"
        },
        {
          "id": "CRA-AMB-002",
          "texto": "¿Se ha determinado y documentado el rol que asume la organización en la cadena de suministro (fabricante, representante autorizado, importador o distribuidor) y las obligaciones específicas que de él se derivan?",
          "ayuda": "El CRA distribuye obligaciones distintas según el operador económico. El fabricante soporta la carga principal (diseño seguro, documentación técnica, evaluación de la conformidad, gestión de vulnerabilidades y notificación). El importador y el distribuidor tienen obligaciones de verificación. Es crítico tener en cuenta el Art. 21: un importador o distribuidor que comercialice un producto con su propio nombre o marca, o que realice una modificación sustancial de un producto ya comercializado, asume todas las obligaciones del fabricante. Una identificación incorrecta del rol lleva a incumplir obligaciones esenciales.",
          "requisito_original": "Se entenderá por operador económico el fabricante, el representante autorizado, el importador, el distribuidor o cualquier otra persona física o jurídica sujeta a obligaciones en relación con la fabricación de productos con elementos digitales o con la comercialización de productos con elementos digitales de conformidad con el presente Reglamento. Se considerará fabricante a un importador o distribuidor, a quien por consiguiente se le aplicará lo dispuesto en los artículos 13 y 14, cuando dicho importador o distribuidor introduzca en el mercado un producto con elementos digitales con su nombre o marca o lleve a cabo una modificación sustancial de un producto con elementos digitales que ya se haya introducido en el mercado.",
          "tipo": "obligatorio",
          "aplicabilidad": [
            "fabricante",
            "importador",
            "distribuidor",
            "representante_autorizado"
          ],
          "peso": 8,
          "nivel": "alto",
          "fase_pds": 1,
          "remediacion": "Identificar y formalizar documentalmente el rol que la organización asume respecto a cada producto. Evaluar si por uso de marca propia o por modificaciones sustanciales se asumen obligaciones de fabricante. Mapear las obligaciones aplicables a ese rol (Arts. 13-14 para fabricantes, Art. 19 para importadores, Art. 20 para distribuidores, Art. 18 para representantes autorizados) y asignar responsables internos para cada una.",
          "referencia_articulo": "Arts. 3, 18, 19, 20, 21 y 22 Reglamento (UE) 2024/2847"
        },
        {
          "id": "CRA-AMB-003",
          "texto": "¿Se ha clasificado formalmente el producto como producto ordinario, producto importante de clase I, producto importante de clase II o producto crítico, conforme a los Anexos III y IV?",
          "ayuda": "La clasificación del producto determina el procedimiento de evaluación de la conformidad exigible (Art. 32). Los productos ordinarios pueden autoevaluarse mediante control interno (módulo A). Los productos importantes de clase I (Anexo III: gestores de contraseñas, navegadores, VPN, sistemas operativos, enrutadores, asistentes virtuales para hogares inteligentes, juguetes conectados, etc.) requieren aplicar normas armonizadas o evaluación por tercero. Los de clase II (cortafuegos, sistemas de detección de intrusiones, hipervisores, microprocesadores resistentes a manipulaciones) exigen siempre evaluación por tercero. Los productos críticos del Anexo IV (dispositivos con cajas de seguridad, pasarelas de contadores inteligentes, tarjetas inteligentes con elementos seguros) pueden quedar sujetos a certificación europea obligatoria.",
          "requisito_original": "Los productos con elementos digitales cuya funcionalidad principal sea la de una categoría de productos establecida en el anexo III se considerarán productos importantes con elementos digitales y estarán sujetos a los procedimientos de evaluación de la conformidad a que se refiere el artículo 32, apartados 2 y 3. Los productos con elementos digitales cuya funcionalidad básica es la de una categoría de productos establecida en el anexo IV se considerarán productos críticos. Las categorías de productos importantes se dividen en las clases I y II establecidas en el anexo III en función del nivel de riesgo de ciberseguridad.",
          "tipo": "obligatorio",
          "aplicabilidad": [
            "fabricante"
          ],
          "peso": 10,
          "nivel": "critico",
          "fase_pds": 1,